<?xml version="1.0" encoding="UTF-8"?><!--DTD generated by XMLSPY v2004 rel. 4 U (http://www.xmlspy.com)--><!ELEMENT CallLevel (#PCDATA)><!ELEMENT CallNumber (#PCDATA)><!ELEMENT CallTime (#PCDATA)><!ELEMENT CallerID (#PCDATA)><!ELEMENT ClassName (#PCDATA)><!ELEMENT ExecutionTime (#PCDATA)><!ELEMENT InterfaceName (#PCDATA)><!ELEMENT MethodName (#PCDATA)><!ELEMENT Palladio.Webserver.BibTeXProvider.BibTeXProvider_IHTTPRequestProcessor_HandleRequest (CallNumber, CallLevel, CallerID, ClassName, InterfaceName, MethodName, CallTime, ReturnTime, ExecutionTime, ThreadID)><!ATTLIST Palladio.Webserver.BibTeXProvider.BibTeXProvider_IHTTPRequestProcessor_HandleRequest	CallNumber ID #REQUIRED	CallerID IDREF #IMPLIED	Calls IDREFS #IMPLIED><!ELEMENT Palladio.Webserver.BibTeXProvider.BibTexDB_IBibTexDB_Search (CallNumber, CallLevel, CallerID, ClassName, InterfaceName, MethodName, CallTime, ReturnTime, ExecutionTime, ThreadID)><!ATTLIST Palladio.Webserver.BibTeXProvider.BibTexDB_IBibTexDB_Search	CallNumber ID #REQUIRED	CallerID IDREF #IMPLIED	Calls IDREFS #IMPLIED><!ELEMENT Palladio.Webserver.BibTeXProvider.BibTexDB_IBibTexDB_SearchAllEntries (CallNumber, CallLevel, CallerID, ClassName, InterfaceName, MethodName, CallTime, ReturnTime, ExecutionTime, ThreadID)><!ATTLIST Palladio.Webserver.BibTeXProvider.BibTexDB_IBibTexDB_SearchAllEntries	CallNumber ID #REQUIRED	CallerID IDREF #IMPLIED	Calls IDREFS #IMPLIED><!ELEMENT Palladio.Webserver.BibTeXProvider.BibTexDB_IBibTexDB_set_ConnectionString (CallNumber, CallLevel, CallerID, ClassName, InterfaceName, MethodName, CallTime, ReturnTime, ExecutionTime, ThreadID)><!ATTLIST Palladio.Webserver.BibTeXProvider.BibTexDB_IBibTexDB_set_ConnectionString	CallNumber ID #REQUIRED	CallerID IDREF #IMPLIED	Calls IDREFS #IMPLIED><!ELEMENT Palladio.Webserver.ConfigReader.WebserverConfiguration_IWebserverConfiguration_GetMimeTypeFor (CallNumber, CallLevel, CallerID, ClassName, InterfaceName, MethodName, CallTime, ReturnTime, ExecutionTime, ThreadID)><!ATTLIST Palladio.Webserver.ConfigReader.WebserverConfiguration_IWebserverConfiguration_GetMimeTypeFor	CallNumber ID #REQUIRED	CallerID IDREF #IMPLIED	Calls IDREFS #IMPLIED><!ELEMENT Palladio.Webserver.ConfigReader.WebserverConfiguration_IWebserverConfiguration_get_ConfigFilesPath (CallNumber, CallLevel, CallerID, ClassName, InterfaceName, MethodName, CallTime, ReturnTime, ExecutionTime, ThreadID)><!ATTLIST Palladio.Webserver.ConfigReader.WebserverConfiguration_IWebserverConfiguration_get_ConfigFilesPath	CallNumber ID #REQUIRED	CallerID IDREF #IMPLIED	Calls IDREFS #IMPLIED><!ELEMENT Palladio.Webserver.ConfigReader.WebserverConfiguration_IWebserverConfiguration_get_DebugFile (CallNumber, CallLevel, CallerID, ClassName, InterfaceName, MethodName, CallTime, ReturnTime, ExecutionTime, ThreadID)><!ATTLIST Palladio.Webserver.ConfigReader.WebserverConfiguration_IWebserverConfiguration_get_DebugFile	CallNumber ID #REQUIRED	CallerID IDREF #IMPLIED	Calls IDREFS #IMPLIED><!ELEMENT Palladio.Webserver.ConfigReader.WebserverConfiguration_IWebserverConfiguration_get_DefaultFileNames (CallNumber, CallLevel, CallerID, ClassName, InterfaceName, MethodName, CallTime, ReturnTime, ExecutionTime, ThreadID)><!ATTLIST Palladio.Webserver.ConfigReader.WebserverConfiguration_IWebserverConfiguration_get_DefaultFileNames	CallNumber ID #REQUIRED	CallerID IDREF #IMPLIED	Calls IDREFS #IMPLIED><!ELEMENT Palladio.Webserver.ConfigReader.WebserverConfiguration_IWebserverConfiguration_get_DefaultMimeType (CallNumber, CallLevel, CallerID, ClassName, InterfaceName, MethodName, CallTime, ReturnTime, ExecutionTime, ThreadID)><!ATTLIST Palladio.Webserver.ConfigReader.WebserverConfiguration_IWebserverConfiguration_get_DefaultMimeType	CallNumber ID #REQUIRED	CallerID IDREF #IMPLIED	Calls IDREFS #IMPLIED><!ELEMENT Palladio.Webserver.ConfigReader.WebserverConfiguration_IWebserverConfiguration_get_DocumentRoot (CallNumber, CallLevel, CallerID, ClassName, InterfaceName, MethodName, CallTime, ReturnTime, ExecutionTime, ThreadID)><!ATTLIST Palladio.Webserver.ConfigReader.WebserverConfiguration_IWebserverConfiguration_get_DocumentRoot	CallNumber ID #REQUIRED	CallerID IDREF #IMPLIED	Calls IDREFS #IMPLIED><!ELEMENT Palladio.Webserver.ConfigReader.WebserverConfiguration_IWebserverConfiguration_get_ListenIP (CallNumber, CallLevel, CallerID, ClassName, InterfaceName, MethodName, CallTime, ReturnTime, ExecutionTime, ThreadID)><!ATTLIST Palladio.Webserver.ConfigReader.WebserverConfiguration_IWebserverConfiguration_get_ListenIP	CallNumber ID #REQUIRED	CallerID IDREF #IMPLIED	Calls IDREFS #IMPLIED><!ELEMENT Palladio.Webserver.ConfigReader.WebserverConfiguration_IWebserverConfiguration_get_ListeningPorts (CallNumber, CallLevel, CallerID, ClassName, InterfaceName, MethodName, CallTime, ReturnTime, ExecutionTime, ThreadID)><!ATTLIST Palladio.Webserver.ConfigReader.WebserverConfiguration_IWebserverConfiguration_get_ListeningPorts	CallNumber ID #REQUIRED	CallerID IDREF #IMPLIED	Calls IDREFS #IMPLIED><!ELEMENT Palladio.Webserver.ConfigReader.WebserverConfiguration_IWebserverConfiguration_get_LogFile (CallNumber, CallLevel, CallerID, ClassName, InterfaceName, MethodName, CallTime, ReturnTime, ExecutionTime, ThreadID)><!ATTLIST Palladio.Webserver.ConfigReader.WebserverConfiguration_IWebserverConfiguration_get_LogFile	CallNumber ID #REQUIRED	CallerID IDREF #IMPLIED	Calls IDREFS #IMPLIED><!ELEMENT Palladio.Webserver.ConfigReader.XMLConfigReader_IConfigReader_ReadConfiguration (CallNumber, CallLevel, CallerID, ClassName, InterfaceName, MethodName, CallTime, ReturnTime, ExecutionTime, ThreadID)><!ATTLIST Palladio.Webserver.ConfigReader.XMLConfigReader_IConfigReader_ReadConfiguration	CallNumber ID #REQUIRED	CallerID IDREF #IMPLIED	Calls IDREFS #IMPLIED><!ELEMENT Palladio.Webserver.Dispatcher.DefaultDispatcher_IDispatcher_Start (CallNumber, CallLevel, CallerID, ClassName, InterfaceName, MethodName, CallTime, ReturnTime, ExecutionTime, ThreadID)><!ATTLIST Palladio.Webserver.Dispatcher.DefaultDispatcher_IDispatcher_Start	CallNumber ID #REQUIRED	CallerID IDREF #IMPLIED	Calls IDREFS #IMPLIED><!ELEMENT Palladio.Webserver.Dispatcher.DefaultDispatcher_IDispatcher_Stop (CallNumber, CallLevel, CallerID, ClassName, InterfaceName, MethodName, CallTime, ReturnTime, ExecutionTime, ThreadID)><!ATTLIST Palladio.Webserver.Dispatcher.DefaultDispatcher_IDispatcher_Stop	CallNumber ID #REQUIRED	CallerID IDREF #IMPLIED	Calls IDREFS #IMPLIED><!ELEMENT Palladio.Webserver.Dispatcher.PortListener_IPortListener_StartListen (CallNumber, CallLevel, CallerID, ClassName, InterfaceName, MethodName, CallTime, ReturnTime, ExecutionTime, ThreadID)><!ATTLIST Palladio.Webserver.Dispatcher.PortListener_IPortListener_StartListen	CallNumber ID #REQUIRED	CallerID IDREF #IMPLIED	Calls IDREFS #IMPLIED><!ELEMENT Palladio.Webserver.Dispatcher.PortListener_IPortListener_get_Address (CallNumber, CallLevel, CallerID, ClassName, InterfaceName, MethodName, CallTime, ReturnTime, ExecutionTime, ThreadID)><!ATTLIST Palladio.Webserver.Dispatcher.PortListener_IPortListener_get_Address	CallNumber ID #REQUIRED	CallerID IDREF #IMPLIED	Calls IDREFS #IMPLIED><!ELEMENT Palladio.Webserver.Dispatcher.PortListener_IPortListener_get_Port (CallNumber, CallLevel, CallerID, ClassName, InterfaceName, MethodName, CallTime, ReturnTime, ExecutionTime, ThreadID)><!ATTLIST Palladio.Webserver.Dispatcher.PortListener_IPortListener_get_Port	CallNumber ID #REQUIRED	CallerID IDREF #IMPLIED	Calls IDREFS #IMPLIED><!ELEMENT Palladio.Webserver.Dispatcher.PortListener_IPortListener_set_IsRunning (CallNumber, CallLevel, CallerID, ClassName, InterfaceName, MethodName, CallTime, ReturnTime, ExecutionTime, ThreadID)><!ATTLIST Palladio.Webserver.Dispatcher.PortListener_IPortListener_set_IsRunning	CallNumber ID #REQUIRED	CallerID IDREF #IMPLIED	Calls IDREFS #IMPLIED><!ELEMENT Palladio.Webserver.DynamicFileProvider.DynamicFileProvider_IHTTPRequestProcessor_HandleRequest (CallNumber, CallLevel, CallerID, ClassName, InterfaceName, MethodName, CallTime, ReturnTime, ExecutionTime, ThreadID)><!ATTLIST Palladio.Webserver.DynamicFileProvider.DynamicFileProvider_IHTTPRequestProcessor_HandleRequest	CallNumber ID #REQUIRED	CallerID IDREF #IMPLIED	Calls IDREFS #IMPLIED><!ELEMENT Palladio.Webserver.HTTPRequestParser.HTTPRequestParser_IRequestParser_HandleRequest (CallNumber, CallLevel, CallerID, ClassName, InterfaceName, MethodName, CallTime, ReturnTime, ExecutionTime, ThreadID)><!ATTLIST Palladio.Webserver.HTTPRequestParser.HTTPRequestParser_IRequestParser_HandleRequest	CallNumber ID #REQUIRED	CallerID IDREF #IMPLIED	Calls IDREFS #IMPLIED><!ELEMENT Palladio.Webserver.HTTPRequestProcessor.DefaultHTTPRequestProcessorTools_IHTTPRequestProcessorTools_BuildCompletePath (CallNumber, CallLevel, CallerID, ClassName, InterfaceName, MethodName, CallTime, ReturnTime, ExecutionTime, ThreadID)><!ATTLIST Palladio.Webserver.HTTPRequestProcessor.DefaultHTTPRequestProcessorTools_IHTTPRequestProcessorTools_BuildCompletePath	CallNumber ID #REQUIRED	CallerID IDREF #IMPLIED	Calls IDREFS #IMPLIED><!ELEMENT Palladio.Webserver.HTTPRequestProcessor.DefaultHTTPRequestProcessorTools_IHTTPRequestProcessorTools_GetFileMimeTypeFor (CallNumber, CallLevel, CallerID, ClassName, InterfaceName, MethodName, CallTime, ReturnTime, ExecutionTime, ThreadID)><!ATTLIST Palladio.Webserver.HTTPRequestProcessor.DefaultHTTPRequestProcessorTools_IHTTPRequestProcessorTools_GetFileMimeTypeFor	CallNumber ID #REQUIRED	CallerID IDREF #IMPLIED	Calls IDREFS #IMPLIED><!ELEMENT Palladio.Webserver.HTTPRequestProcessor.DefaultHTTPRequestProcessorTools_IHTTPRequestProcessorTools_OpenFile (CallNumber, CallLevel, CallerID, ClassName, InterfaceName, MethodName, CallTime, ReturnTime, ExecutionTime, ThreadID)><!ATTLIST Palladio.Webserver.HTTPRequestProcessor.DefaultHTTPRequestProcessorTools_IHTTPRequestProcessorTools_OpenFile	CallNumber ID #REQUIRED	CallerID IDREF #IMPLIED	Calls IDREFS #IMPLIED><!ELEMENT Palladio.Webserver.HTTPRequestProcessor.DefaultHTTPRequestProcessorTools_IHTTPRequestProcessorTools_SendContentDataToClient (CallNumber, CallLevel, CallerID, ClassName, InterfaceName, MethodName, CallTime, ReturnTime, ExecutionTime, ThreadID)><!ATTLIST Palladio.Webserver.HTTPRequestProcessor.DefaultHTTPRequestProcessorTools_IHTTPRequestProcessorTools_SendContentDataToClient	CallNumber ID #REQUIRED	CallerID IDREF #IMPLIED	Calls IDREFS #IMPLIED><!ELEMENT Palladio.Webserver.HTTPRequestProcessor.DefaultHTTPRequestProcessorTools_IHTTPRequestProcessorTools_SendContentToClient (CallNumber, CallLevel, CallerID, ClassName, InterfaceName, MethodName, CallTime, ReturnTime, ExecutionTime, ThreadID)><!ATTLIST Palladio.Webserver.HTTPRequestProcessor.DefaultHTTPRequestProcessorTools_IHTTPRequestProcessorTools_SendContentToClient	CallNumber ID #REQUIRED	CallerID IDREF #IMPLIED	Calls IDREFS #IMPLIED><!ELEMENT Palladio.Webserver.HTTPRequestProcessor.DefaultHTTPRequestProcessorTools_IHTTPRequestProcessorTools_SendHTTPError (CallNumber, CallLevel, CallerID, ClassName, InterfaceName, MethodName, CallTime, ReturnTime, ExecutionTime, ThreadID)><!ATTLIST Palladio.Webserver.HTTPRequestProcessor.DefaultHTTPRequestProcessorTools_IHTTPRequestProcessorTools_SendHTTPError	CallNumber ID #REQUIRED	CallerID IDREF #IMPLIED	Calls IDREFS #IMPLIED><!ELEMENT Palladio.Webserver.HTTPRequestProcessor.DefaultHTTPRequestProcessorTools_IHTTPRequestProcessorTools_SendHTTPHeader (CallNumber, CallLevel, CallerID, ClassName, InterfaceName, MethodName, CallTime, ReturnTime, ExecutionTime, ThreadID)><!ATTLIST Palladio.Webserver.HTTPRequestProcessor.DefaultHTTPRequestProcessorTools_IHTTPRequestProcessorTools_SendHTTPHeader	CallNumber ID #REQUIRED	CallerID IDREF #IMPLIED	Calls IDREFS #IMPLIED><!ELEMENT Palladio.Webserver.SimpleTemplateFileProvider.SimpleTemplateFileProvider_IHTTPRequestProcessor_HandleRequest (CallNumber, CallLevel, CallerID, ClassName, InterfaceName, MethodName, CallTime, ReturnTime, ExecutionTime, ThreadID)><!ATTLIST Palladio.Webserver.SimpleTemplateFileProvider.SimpleTemplateFileProvider_IHTTPRequestProcessor_HandleRequest	CallNumber ID #REQUIRED	CallerID IDREF #IMPLIED	Calls IDREFS #IMPLIED><!ELEMENT Palladio.Webserver.StaticFileProvider.StaticFileProvider_IHTTPRequestProcessor_HandleRequest (CallNumber, CallLevel, CallerID, ClassName, InterfaceName, MethodName, CallTime, ReturnTime, ExecutionTime, ThreadID)><!ATTLIST Palladio.Webserver.StaticFileProvider.StaticFileProvider_IHTTPRequestProcessor_HandleRequest	CallNumber ID #REQUIRED	CallerID IDREF #IMPLIED	Calls IDREFS #IMPLIED><!ELEMENT Palladio.Webserver.WebserverMonitor.DefaultWebserverMonitor_IWebserverMonitor_FinishWriteAccess (CallNumber, CallLevel, CallerID, ClassName, InterfaceName, MethodName, CallTime, ReturnTime, ExecutionTime, ThreadID)><!ATTLIST Palladio.Webserver.WebserverMonitor.DefaultWebserverMonitor_IWebserverMonitor_FinishWriteAccess	CallNumber ID #REQUIRED	CallerID IDREF #IMPLIED	Calls IDREFS #IMPLIED><!ELEMENT Palladio.Webserver.WebserverMonitor.DefaultWebserverMonitor_IWebserverMonitor_InitializeWriteAccess (CallNumber, CallLevel, CallerID, ClassName, InterfaceName, MethodName, CallTime, ReturnTime, ExecutionTime, ThreadID)><!ATTLIST Palladio.Webserver.WebserverMonitor.DefaultWebserverMonitor_IWebserverMonitor_InitializeWriteAccess	CallNumber ID #REQUIRED	CallerID IDREF #IMPLIED	Calls IDREFS #IMPLIED><!ELEMENT Palladio.Webserver.WebserverMonitor.DefaultWebserverMonitor_IWebserverMonitor_WriteLogEntry (CallNumber, CallLevel, CallerID, ClassName, InterfaceName, MethodName, CallTime, ReturnTime, ExecutionTime, ThreadID)><!ATTLIST Palladio.Webserver.WebserverMonitor.DefaultWebserverMonitor_IWebserverMonitor_WriteLogEntry	CallNumber ID #REQUIRED	CallerID IDREF #IMPLIED	Calls IDREFS #IMPLIED><!ELEMENT ReturnTime (#PCDATA)><!ELEMENT RunID (#PCDATA)><!ELEMENT ThreadID (#PCDATA)><!ELEMENT WebserverMeasure (RunID | Palladio.Webserver.ConfigReader.XMLConfigReader_IConfigReader_ReadConfiguration | Palladio.Webserver.ConfigReader.WebserverConfiguration_IWebserverConfiguration_get_ConfigFilesPath | Palladio.Webserver.ConfigReader.WebserverConfiguration_IWebserverConfiguration_get_DebugFile | Palladio.Webserver.ConfigReader.WebserverConfiguration_IWebserverConfiguration_get_LogFile | Palladio.Webserver.WebserverMonitor.DefaultWebserverMonitor_IWebserverMonitor_InitializeWriteAccess | Palladio.Webserver.WebserverMonitor.DefaultWebserverMonitor_IWebserverMonitor_WriteLogEntry | Palladio.Webserver.ConfigReader.WebserverConfiguration_IWebserverConfiguration_get_ListenIP | Palladio.Webserver.ConfigReader.WebserverConfiguration_IWebserverConfiguration_get_ListeningPorts | Palladio.Webserver.Dispatcher.DefaultDispatcher_IDispatcher_Start | Palladio.Webserver.BibTeXProvider.BibTeXProvider_IHTTPRequestProcessor_HandleRequest | Palladio.Webserver.BibTeXProvider.BibTexDB_IBibTexDB_Search | Palladio.Webserver.BibTeXProvider.BibTexDB_IBibTexDB_SearchAllEntries | Palladio.Webserver.BibTeXProvider.BibTexDB_IBibTexDB_set_ConnectionString | Palladio.Webserver.ConfigReader.WebserverConfiguration_IWebserverConfiguration_GetMimeTypeFor | Palladio.Webserver.ConfigReader.WebserverConfiguration_IWebserverConfiguration_get_DefaultFileNames | Palladio.Webserver.ConfigReader.WebserverConfiguration_IWebserverConfiguration_get_DefaultMimeType | Palladio.Webserver.ConfigReader.WebserverConfiguration_IWebserverConfiguration_get_DocumentRoot | Palladio.Webserver.Dispatcher.DefaultDispatcher_IDispatcher_Stop | Palladio.Webserver.Dispatcher.PortListener_IPortListener_StartListen | Palladio.Webserver.Dispatcher.PortListener_IPortListener_get_Address | Palladio.Webserver.Dispatcher.PortListener_IPortListener_get_Port | Palladio.Webserver.Dispatcher.PortListener_IPortListener_set_IsRunning | Palladio.Webserver.DynamicFileProvider.DynamicFileProvider_IHTTPRequestProcessor_HandleRequest | Palladio.Webserver.HTTPRequestParser.HTTPRequestParser_IRequestParser_HandleRequest | Palladio.Webserver.HTTPRequestProcessor.DefaultHTTPRequestProcessorTools_IHTTPRequestProcessorTools_BuildCompletePath | Palladio.Webserver.HTTPRequestProcessor.DefaultHTTPRequestProcessorTools_IHTTPRequestProcessorTools_GetFileMimeTypeFor | Palladio.Webserver.HTTPRequestProcessor.DefaultHTTPRequestProcessorTools_IHTTPRequestProcessorTools_OpenFile | Palladio.Webserver.HTTPRequestProcessor.DefaultHTTPRequestProcessorTools_IHTTPRequestProcessorTools_SendContentDataToClient | Palladio.Webserver.HTTPRequestProcessor.DefaultHTTPRequestProcessorTools_IHTTPRequestProcessorTools_SendContentToClient | Palladio.Webserver.HTTPRequestProcessor.DefaultHTTPRequestProcessorTools_IHTTPRequestProcessorTools_SendHTTPError | Palladio.Webserver.HTTPRequestProcessor.DefaultHTTPRequestProcessorTools_IHTTPRequestProcessorTools_SendHTTPHeader | Palladio.Webserver.SimpleTemplateFileProvider.SimpleTemplateFileProvider_IHTTPRequestProcessor_HandleRequest | Palladio.Webserver.StaticFileProvider.StaticFileProvider_IHTTPRequestProcessor_HandleRequest | Palladio.Webserver.WebserverMonitor.DefaultWebserverMonitor_IWebserverMonitor_FinishWriteAccess)+>