<?xml version="1.0"?>
<!DOCTYPE WebserverMeasure SYSTEM "WebserverMeasure.dtd">
<WebserverMeasure>
  <RunID>7</RunID>
  <Palladio.Webserver.ConfigReader.XMLConfigReader_IConfigReader_ReadConfiguration CallNumber="_1">
    <CallNumber>1</CallNumber>
    <CallLevel>1</CallLevel>
    <CallerID>0</CallerID>
    <ClassName>Palladio.Webserver.ConfigReader.XMLConfigReader</ClassName>
    <InterfaceName>IConfigReader</InterfaceName>
    <MethodName>ReadConfiguration</MethodName>
    <CallTime>8044325607</CallTime>
    <ReturnTime>8044422966</ReturnTime>
    <ExecutionTime>97359</ExecutionTime>
    <ThreadID>1</ThreadID>
  </Palladio.Webserver.ConfigReader.XMLConfigReader_IConfigReader_ReadConfiguration>
  <Palladio.Webserver.ConfigReader.WebserverConfiguration_IWebserverConfiguration_get_ConfigFilesPath CallNumber="_2">
    <CallNumber>2</CallNumber>
    <CallLevel>1</CallLevel>
    <CallerID>0</CallerID>
    <ClassName>Palladio.Webserver.ConfigReader.WebserverConfiguration</ClassName>
    <InterfaceName>IWebserverConfiguration</InterfaceName>
    <MethodName>get_ConfigFilesPath</MethodName>
    <CallTime>8045469236</CallTime>
    <ReturnTime>8045469684</ReturnTime>
    <ExecutionTime>448</ExecutionTime>
    <ThreadID>1</ThreadID>
  </Palladio.Webserver.ConfigReader.WebserverConfiguration_IWebserverConfiguration_get_ConfigFilesPath>
  <Palladio.Webserver.ConfigReader.WebserverConfiguration_IWebserverConfiguration_get_ConfigFilesPath CallNumber="_3">
    <CallNumber>3</CallNumber>
    <CallLevel>1</CallLevel>
    <CallerID>0</CallerID>
    <ClassName>Palladio.Webserver.ConfigReader.WebserverConfiguration</ClassName>
    <InterfaceName>IWebserverConfiguration</InterfaceName>
    <MethodName>get_ConfigFilesPath</MethodName>
    <CallTime>8046052204</CallTime>
    <ReturnTime>8046052216</ReturnTime>
    <ExecutionTime>12</ExecutionTime>
    <ThreadID>1</ThreadID>
  </Palladio.Webserver.ConfigReader.WebserverConfiguration_IWebserverConfiguration_get_ConfigFilesPath>
  <Palladio.Webserver.ConfigReader.WebserverConfiguration_IWebserverConfiguration_get_DebugFile CallNumber="_5" CallerID="_4">
    <CallNumber>5</CallNumber>
    <CallLevel>2</CallLevel>
    <CallerID>4</CallerID>
    <ClassName>Palladio.Webserver.ConfigReader.WebserverConfiguration</ClassName>
    <InterfaceName>IWebserverConfiguration</InterfaceName>
    <MethodName>get_DebugFile</MethodName>
    <CallTime>8046572938</CallTime>
    <ReturnTime>8046603443</ReturnTime>
    <ExecutionTime>30505</ExecutionTime>
    <ThreadID>1</ThreadID>
  </Palladio.Webserver.ConfigReader.WebserverConfiguration_IWebserverConfiguration_get_DebugFile>
  <Palladio.Webserver.ConfigReader.WebserverConfiguration_IWebserverConfiguration_get_LogFile CallNumber="_6" CallerID="_4">
    <CallNumber>6</CallNumber>
    <CallLevel>2</CallLevel>
    <CallerID>4</CallerID>
    <ClassName>Palladio.Webserver.ConfigReader.WebserverConfiguration</ClassName>
    <InterfaceName>IWebserverConfiguration</InterfaceName>
    <MethodName>get_LogFile</MethodName>
    <CallTime>8046606869</CallTime>
    <ReturnTime>8046617354</ReturnTime>
    <ExecutionTime>10485</ExecutionTime>
    <ThreadID>1</ThreadID>
  </Palladio.Webserver.ConfigReader.WebserverConfiguration_IWebserverConfiguration_get_LogFile>
  <Palladio.Webserver.WebserverMonitor.DefaultWebserverMonitor_IWebserverMonitor_InitializeWriteAccess CallNumber="_4" Calls="_5 _6">
    <CallNumber>4</CallNumber>
    <CallLevel>1</CallLevel>
    <CallerID>0</CallerID>
    <ClassName>Palladio.Webserver.WebserverMonitor.DefaultWebserverMonitor</ClassName>
    <InterfaceName>IWebserverMonitor</InterfaceName>
    <MethodName>InitializeWriteAccess</MethodName>
    <CallTime>8046569947</CallTime>
    <ReturnTime>8046622329</ReturnTime>
    <ExecutionTime>52382</ExecutionTime>
    <ThreadID>1</ThreadID>
  </Palladio.Webserver.WebserverMonitor.DefaultWebserverMonitor_IWebserverMonitor_InitializeWriteAccess>
  <Palladio.Webserver.WebserverMonitor.DefaultWebserverMonitor_IWebserverMonitor_WriteLogEntry CallNumber="_8" CallerID="_7">
    <CallNumber>8</CallNumber>
    <CallLevel>2</CallLevel>
    <CallerID>7</CallerID>
    <ClassName>Palladio.Webserver.WebserverMonitor.DefaultWebserverMonitor</ClassName>
    <InterfaceName>IWebserverMonitor</InterfaceName>
    <MethodName>WriteLogEntry</MethodName>
    <CallTime>8046626624</CallTime>
    <ReturnTime>8046629282</ReturnTime>
    <ExecutionTime>2658</ExecutionTime>
    <ThreadID>1</ThreadID>
  </Palladio.Webserver.WebserverMonitor.DefaultWebserverMonitor_IWebserverMonitor_WriteLogEntry>
  <Palladio.Webserver.WebserverMonitor.DefaultWebserverMonitor_IWebserverMonitor_WriteLogEntry CallNumber="_9" CallerID="_7">
    <CallNumber>9</CallNumber>
    <CallLevel>2</CallLevel>
    <CallerID>7</CallerID>
    <ClassName>Palladio.Webserver.WebserverMonitor.DefaultWebserverMonitor</ClassName>
    <InterfaceName>IWebserverMonitor</InterfaceName>
    <MethodName>WriteLogEntry</MethodName>
    <CallTime>8046629351</CallTime>
    <ReturnTime>8046630175</ReturnTime>
    <ExecutionTime>824</ExecutionTime>
    <ThreadID>1</ThreadID>
  </Palladio.Webserver.WebserverMonitor.DefaultWebserverMonitor_IWebserverMonitor_WriteLogEntry>
  <Palladio.Webserver.ConfigReader.WebserverConfiguration_IWebserverConfiguration_get_ListenIP CallNumber="_10" CallerID="_7">
    <CallNumber>10</CallNumber>
    <CallLevel>2</CallLevel>
    <CallerID>7</CallerID>
    <ClassName>Palladio.Webserver.ConfigReader.WebserverConfiguration</ClassName>
    <InterfaceName>IWebserverConfiguration</InterfaceName>
    <MethodName>get_ListenIP</MethodName>
    <CallTime>8046631123</CallTime>
    <ReturnTime>8046637566</ReturnTime>
    <ExecutionTime>6443</ExecutionTime>
    <ThreadID>1</ThreadID>
  </Palladio.Webserver.ConfigReader.WebserverConfiguration_IWebserverConfiguration_get_ListenIP>
  <Palladio.Webserver.ConfigReader.WebserverConfiguration_IWebserverConfiguration_get_ListeningPorts CallNumber="_11" CallerID="_7">
    <CallNumber>11</CallNumber>
    <CallLevel>2</CallLevel>
    <CallerID>7</CallerID>
    <ClassName>Palladio.Webserver.ConfigReader.WebserverConfiguration</ClassName>
    <InterfaceName>IWebserverConfiguration</InterfaceName>
    <MethodName>get_ListeningPorts</MethodName>
    <CallTime>8046640556</CallTime>
    <ReturnTime>8046661092</ReturnTime>
    <ExecutionTime>20536</ExecutionTime>
    <ThreadID>1</ThreadID>
  </Palladio.Webserver.ConfigReader.WebserverConfiguration_IWebserverConfiguration_get_ListeningPorts>
  <Palladio.Webserver.ConfigReader.WebserverConfiguration_IWebserverConfiguration_get_ListeningPorts CallNumber="_12" CallerID="_7">
    <CallNumber>12</CallNumber>
    <CallLevel>2</CallLevel>
    <CallerID>7</CallerID>
    <ClassName>Palladio.Webserver.ConfigReader.WebserverConfiguration</ClassName>
    <InterfaceName>IWebserverConfiguration</InterfaceName>
    <MethodName>get_ListeningPorts</MethodName>
    <CallTime>8046661145</CallTime>
    <ReturnTime>8046661186</ReturnTime>
    <ExecutionTime>41</ExecutionTime>
    <ThreadID>1</ThreadID>
  </Palladio.Webserver.ConfigReader.WebserverConfiguration_IWebserverConfiguration_get_ListeningPorts>
  <Palladio.Webserver.ConfigReader.WebserverConfiguration_IWebserverConfiguration_get_ListeningPorts CallNumber="_13" CallerID="_7">
    <CallNumber>13</CallNumber>
    <CallLevel>2</CallLevel>
    <CallerID>7</CallerID>
    <ClassName>Palladio.Webserver.ConfigReader.WebserverConfiguration</ClassName>
    <InterfaceName>IWebserverConfiguration</InterfaceName>
    <MethodName>get_ListeningPorts</MethodName>
    <CallTime>8046668669</CallTime>
    <ReturnTime>8046668753</ReturnTime>
    <ExecutionTime>84</ExecutionTime>
    <ThreadID>1</ThreadID>
  </Palladio.Webserver.ConfigReader.WebserverConfiguration_IWebserverConfiguration_get_ListeningPorts>
  <Palladio.Webserver.Dispatcher.DefaultDispatcher_IDispatcher_Start CallNumber="_7" Calls="_8 _9 _10 _11 _12 _13">
    <CallNumber>7</CallNumber>
    <CallLevel>1</CallLevel>
    <CallerID>0</CallerID>
    <ClassName>Palladio.Webserver.Dispatcher.DefaultDispatcher</ClassName>
    <InterfaceName>IDispatcher</InterfaceName>
    <MethodName>Start</MethodName>
    <CallTime>8046623311</CallTime>
    <ReturnTime>8046669236</ReturnTime>
    <ExecutionTime>45925</ExecutionTime>
    <ThreadID>1</ThreadID>
  </Palladio.Webserver.Dispatcher.DefaultDispatcher_IDispatcher_Start>
  <Palladio.Webserver.ConfigReader.WebserverConfiguration_IWebserverConfiguration_get_ListenIP CallNumber="_16" CallerID="_15">
    <CallNumber>16</CallNumber>
    <CallLevel>2</CallLevel>
    <CallerID>15</CallerID>
    <ClassName>Palladio.Webserver.ConfigReader.WebserverConfiguration</ClassName>
    <InterfaceName>IWebserverConfiguration</InterfaceName>
    <MethodName>get_ListenIP</MethodName>
    <CallTime>8046710513</CallTime>
    <ReturnTime>8046710569</ReturnTime>
    <ExecutionTime>56</ExecutionTime>
    <ThreadID>3</ThreadID>
  </Palladio.Webserver.ConfigReader.WebserverConfiguration_IWebserverConfiguration_get_ListenIP>
  <Palladio.Webserver.ConfigReader.WebserverConfiguration_IWebserverConfiguration_get_ListenIP CallNumber="_18" CallerID="_14">
    <CallNumber>18</CallNumber>
    <CallLevel>2</CallLevel>
    <CallerID>14</CallerID>
    <ClassName>Palladio.Webserver.ConfigReader.WebserverConfiguration</ClassName>
    <InterfaceName>IWebserverConfiguration</InterfaceName>
    <MethodName>get_ListenIP</MethodName>
    <CallTime>8046715582</CallTime>
    <ReturnTime>8046715635</ReturnTime>
    <ExecutionTime>53</ExecutionTime>
    <ThreadID>2</ThreadID>
  </Palladio.Webserver.ConfigReader.WebserverConfiguration_IWebserverConfiguration_get_ListenIP>
  <Palladio.Webserver.WebserverMonitor.DefaultWebserverMonitor_IWebserverMonitor_WriteLogEntry CallNumber="_17" CallerID="_15">
    <CallNumber>17</CallNumber>